{
  "$schema":"https://json-schema.org/draft/2020-12/schema",
  "title":"Senior Language OS Pack v2",
  "type":"object",
  "required":["meta","phases","days"],
  "properties":{
    "meta":{"type":"object","required":["id","name","targetLanguage","version"],"properties":{"id":{"type":"string"},"name":{"type":"string"},"targetLanguage":{"type":"string"},"locale":{"type":"string"},"version":{"type":"string"},"description":{"type":"string"}}},
    "phases":{"type":"array","minItems":1},
    "realLifeMap":{"type":"array","items":{"type":"string"}},
    "days":{"type":"array","minItems":1,"items":{"type":"object","required":["day","title","goal","engine","drills","mission"],"properties":{"recall":{"type":"array"},"listening":{"type":"array"}}}}
  }
}
