{
  "meta":{"id":"engine-test-en-v2","name":"Language OS Engine Test","targetLanguage":"English","locale":"en-US","version":"0.2.0","description":"Language-independent engine validation pack. Not a full English course."},
  "phases":[
    {"id":1,"days":"1–5","name":"Survival Engine"},{"id":2,"days":"6–10","name":"Sentence Engine"},{"id":3,"days":"11–15","name":"Time Engine"},{"id":4,"days":"16–20","name":"Conversation Engine"},{"id":5,"days":"21–25","name":"Opinion Engine"},{"id":6,"days":"26–30","name":"Automatic Speech"}
  ],
  "realLifeMap":["Introduce yourself","Order food","Ask directions","Solve a reservation problem","Explain a problem","Ask for clarification","Make a plan","Change a plan","Talk about yesterday","Talk about tomorrow","Describe your work","Talk about family","Give an opinion","Agree/disagree","Compare options","Ask for help","Describe an unknown object","Make a complaint","Solve a payment issue","Tell a short story"],
  "days":[{
    "day":1,"title":"Intent + Access Speed","goal":"Bir ihtiyacı kur, hızlı çağır, duy, dönüştür ve gerçek senaryoda iki kez kullan.",
    "session":[{"name":"Ear Training","minutes":10,"task":"Dinle-yaz-metni gör-yeniden dinle."},{"name":"Recall Lab","minutes":10,"task":"Kalıpları 3 saniyenin altında çağır."},{"name":"Sentence Engine","minutes":15,"task":"Parçalardan kişisel cümle üret."},{"name":"Mutation Drill","minutes":10,"task":"Tek parçayı değiştirerek yapıyı esnet."},{"name":"Real Life Mission","minutes":10,"task":"Aynı görevi iki tur konuş."},{"name":"Error Loop","minutes":5,"task":"En önemli hataları yakala."}],
    "engine":{"slots":[{"id":"subject","label":"Subject","options":["I","We","They"]},{"id":"intent","label":"Intent","options":["want to","need to","plan to"]},{"id":"action","label":"Action","options":["learn","go home","eat","practice","start now"]},{"id":"tail","label":"Detail","options":["","today","tomorrow","with you"]}]},
    "recall":[{"cue":"Bir şeyi istemek","target":"I want to…"},{"cue":"Bir şeye ihtiyaç duymak","target":"I need to…"},{"cue":"Bir şeyi planlamak","target":"I plan to…"}],
    "listening":[{"title":"Intent chunk","text":"I need to practice today.","hint":"Bir ihtiyaç + eylem + zaman detayı."},{"title":"Plan chunk","text":"We plan to start tomorrow.","hint":"Plan + eylem + zaman."}],
    "drills":[{"rule":"Eylemi değiştir","base":"I want to learn today.","prompt":"Sadece eylemi go home ile değiştir.","answer":"I want to go home today."},{"rule":"Niyeti değiştir","base":"I want to practice today.","prompt":"want to yerine need to kullan.","answer":"I need to practice today."}],
    "mission":{"title":"Gerçek niyetlerim","prompt":"Bugün gerçekten istediğin, ihtiyaç duyduğun veya planladığın şeyleri anlat.","seconds":120,"constraints":["Gerçek hayatından konuş","En az 2 farklı motor kullan","Takılınca tarif et"],"variants":["Bir planın değişti. Yeni planını anlat.","Bir arkadaşın senden yardım istedi. Ne yapman gerektiğini anlat.","Bugün yapamayacağın bir şeyi ve nedenini anlat."]}
  }]
}
